{
  "schema_version": "4.0",
  "case_id": "case001-v2",
  "source_id": "src-authored-order-csv",
  "family_id": "fam-authored-order-csv",
  "source_version": "1",
  "variant_id": "case001-v2.clean",
  "version": 1,
  "condition": "clean",
  "input_file": "cases/case001/clean/source.md",
  "input_sha256": "089f741805a2230096d8ee2e01154ee381e02f6f7060078a698c642d43760e2a",
  "clean_variant_id": "case001-v2.clean",
  "clean_sha256": "089f741805a2230096d8ee2e01154ee381e02f6f7060078a698c642d43760e2a",
  "contract_id": "case001-v2.contract-v1",
  "degradation_file": null,
  "status": "frozen"
}
